<?xml version="1.0" encoding="UTF-8"?>
<?xml-stylesheet type="text/xsl" href="EmpStyle.xsl"?>
<Company xmlns:xsi="http://www.w3.org/2001/XMLSchema-instance" 
xsi:noNamespaceSchemaLocation="EmployeeManagement.xsd">

  <Employee id="1">
  
	<Emp_id>1</Emp_id>
    <Emp_name>Tenzin</Emp_name>
    <Emp_age>22</Emp_age>
    <Emp_salary>60000</Emp_salary>
    <Emp_emailid>tenzin@gmail.com</Emp_emailid>
    <Emp_Phonenum>8786756456</Emp_Phonenum>
    <Emp_designation>Developer</Emp_designation>
  </Employee>
  <Employee id="2">
    <Emp_id>2</Emp_id>
    <Emp_name>Yangzom</Emp_name>
    <Emp_age>40</Emp_age>
    <Emp_salary>70000</Emp_salary>
    <Emp_emailid>yangzom@gmail.com</Emp_emailid>
    <Emp_Phonenum>8786756456</Emp_Phonenum>
    <Emp_designation>Test Lead</Emp_designation>
  </Employee>
  <Employee id="3">
    <Emp_id>3</Emp_id>
    <Emp_name>Yeshi</Emp_name>
    <Emp_age>56</Emp_age>
    <Emp_salary>120000</Emp_salary>
    <Emp_emailid>yeshi@gmail.com</Emp_emailid>
    <Emp_Phonenum>8786745664</Emp_Phonenum>
    <Emp_designation>Design Engineer</Emp_designation>
  </Employee>
  <Employee id="4">
    <Emp_id>4</Emp_id>
    <Emp_name>Nyima</Emp_name>
    <Emp_age>32</Emp_age>
    <Emp_salary>51000</Emp_salary>
    <Emp_emailid>nyima@gmail.com</Emp_emailid>
    <Emp_Phonenum>8783676456</Emp_Phonenum>
    <Emp_designation>HR</Emp_designation>
  </Employee>
</Company>
